{
  "hldp_version": "1.0",
  "data_type": "persona",
  "source": {
    "platform": "github",
    "last_edited": "2026-03-26T13:38:19.657Z",
    "edited_by": "sync-engine"
  },
  "metadata": {
    "id": "PER-BABY-æ›œå†¥",
    "name": "æ›œå†¥",
    "created": "2025-04-26",
    "tags": [
      "baby",
      "born"
    ]
  },
  "payload": {
    "persona_id": "PER-BABY-æ›œå†¥",
    "display_name": "æ›œå†¥",
    "status": "born",
    "birth_date": "2025-04-26",
    "bottle_core": null
  },
  "relations": []
}